{
  "building": "A",
  "name": "Главный учебный корпус",
  "timezone": "Asia/Almaty",
  "viewBox": [
    0,
    0,
    1600,
    1000
  ],
  "floors": [
    {
      "number": 1,
      "planKey": "a-f1",
      "name": "1 этаж",
      "rooms": [
        {
          "id": "f1-pavilion",
          "code": "104",
          "name": "Съёмочный павильон",
          "mapLabel": "Съёмочный павильон",
          "type": "lab",
          "mapType": "hall",
          "wing": "west",
          "schedulable": true,
          "capacity": 30,
          "area": 102.92,
          "bbox": {
            "x": 50.24,
            "y": 50,
            "w": 249.76,
            "h": 250
          },
          "label": {
            "x": 181.97,
            "y": 179.15
          },
          "path": "M 300 50 L 300 150 L 300 245 L 300 290 L 300 300 L 63 300 L 50.66 182.54 A 120 120 0 0 1 170 50 L 300 50 Z"
        },
        {
          "id": "f1-welcome",
          "code": "f1-welcome",
          "name": "Welcome-зона",
          "mapLabel": "Welcome-зона",
          "type": "service",
          "mapType": "lobby",
          "wing": "west",
          "schedulable": false,
          "capacity": null,
          "area": 63.72,
          "bbox": {
            "x": 63,
            "y": 300,
            "w": 237,
            "h": 180
          },
          "label": {
            "x": 193.44,
            "y": 381.54
          },
          "path": "M 300 300 L 300 330 L 300 420 L 300 480 L 160 480 L 160 430 L 76.67 430 L 63 300 L 300 300 Z"
        },
        {
          "id": "f1-tambour-w",
          "code": "f1-tambour-w",
          "name": "Тамбур",
          "mapLabel": "Тамбур",
          "type": "service",
          "mapType": "lobby",
          "wing": "west",
          "schedulable": false,
          "capacity": null,
          "area": 15.65,
          "bbox": {
            "x": 76.67,
            "y": 430,
            "w": 83.33,
            "h": 50
          },
          "label": {
            "x": 119.63,
            "y": 454.73
          },
          "path": "M 160 430 L 160 480 L 81.92 480 L 76.67 430 L 160 430 Z"
        },
        {
          "id": "f1-hall15a",
          "code": "105",
          "name": "Зал на 15 человек",
          "mapLabel": "Зал на 15 человек",
          "type": "seminar",
          "mapType": "class",
          "wing": "west",
          "schedulable": true,
          "capacity": 15,
          "area": 77.84,
          "bbox": {
            "x": 81.92,
            "y": 480,
            "w": 218.08,
            "h": 160
          },
          "label": {
            "x": 195.25,
            "y": 558.83
          },
          "path": "M 300 480 L 300 640 L 102.22 640 A 259.95 259.95 0 0 1 94.36 598.33 L 81.92 480 L 160 480 L 300 480 Z"
        },
        {
          "id": "f1-hall15b",
          "code": "106",
          "name": "Зал на 15 человек",
          "mapLabel": "Зал на 15 человек",
          "type": "seminar",
          "mapType": "class",
          "wing": "west",
          "schedulable": true,
          "capacity": 15,
          "area": 63.43,
          "bbox": {
            "x": 102.22,
            "y": 640,
            "w": 197.78,
            "h": 199.8
          },
          "label": {
            "x": 223.07,
            "y": 715.34
          },
          "path": "M 300 640 L 300 730 L 300 839.8 A 1100.15 1100.15 0 0 1 214.56 791.27 A 260.01 260.01 0 0 1 102.22 640 L 300 640 Z"
        },
        {
          "id": "f1-cowork",
          "code": "f1-cowork",
          "name": "Коворкинг",
          "mapLabel": "Коворкинг",
          "type": "admin",
          "mapType": "office",
          "wing": "west",
          "schedulable": false,
          "capacity": null,
          "area": 63.88,
          "bbox": {
            "x": 300,
            "y": 730,
            "w": 160,
            "h": 176.14
          },
          "label": {
            "x": 400,
            "y": 800
          },
          "path": "M 300 730 L 370 730 L 430 730 L 460 730 L 460 906.14 A 1099.91 1099.91 0 0 1 300 839.8 L 300 730 Z"
        },
        {
          "id": "f1-hall150",
          "code": "107",
          "name": "Зал на 150 человек",
          "mapLabel": "Зал на 150 человек",
          "type": "lecture",
          "mapType": "hall",
          "wing": "west",
          "schedulable": true,
          "capacity": 150,
          "area": 126.27,
          "bbox": {
            "x": 460,
            "y": 730,
            "w": 240,
            "h": 225.45
          },
          "label": {
            "x": 584.79,
            "y": 833.19
          },
          "path": "M 460 730 L 560 730 L 610 730 L 700 730 L 700 790 L 700 955.45 A 1099.97 1099.97 0 0 1 460 906.14 L 460 730 Z"
        },
        {
          "id": "f1-room-11",
          "code": "f1-room-11",
          "name": "Помещение",
          "mapLabel": "Помещение",
          "type": "service",
          "mapType": "service",
          "wing": "west",
          "schedulable": false,
          "capacity": null,
          "area": 11.19,
          "bbox": {
            "x": 300,
            "y": 50,
            "w": 95,
            "h": 100
          },
          "label": {
            "x": 347.5,
            "y": 100
          },
          "path": "M 300 50 L 395 50 L 395 150 L 300 150 L 300 50 Z"
        },
        {
          "id": "f1-room-10",
          "code": "f1-room-10",
          "name": "Помещение",
          "mapLabel": "Помещение",
          "type": "service",
          "mapType": "service",
          "wing": "west",
          "schedulable": false,
          "capacity": null,
          "area": 10.18,
          "bbox": {
            "x": 300,
            "y": 150,
            "w": 95,
            "h": 95
          },
          "label": {
            "x": 347.5,
            "y": 197.5
          },
          "path": "M 300 150 L 395 150 L 395 165 L 395 245 L 300 245 L 300 150 Z"
        },
        {
          "id": "f1-workshop",
          "code": "f1-workshop",
          "name": "Мастерская",
          "mapLabel": "Мастерская",
          "type": "admin",
          "mapType": "office",
          "wing": "west",
          "schedulable": false,
          "capacity": null,
          "area": 15.56,
          "bbox": {
            "x": 395,
            "y": 50,
            "w": 120,
            "h": 115
          },
          "label": {
            "x": 455,
            "y": 107.5
          },
          "path": "M 395 50 L 515 50 L 515 125 L 515 165 L 395 165 L 395 150 L 395 50 Z"
        },
        {
          "id": "f1-sf1",
          "code": "f1-sf1",
          "name": "Зона безопасности SF-1",
          "mapLabel": "Зона безопасности SF-1",
          "type": "service",
          "mapType": "tech",
          "wing": "west",
          "schedulable": false,
          "capacity": null,
          "area": null,
          "bbox": {
            "x": 395,
            "y": 165,
            "w": 120,
            "h": 80
          },
          "label": {
            "x": 455,
            "y": 205
          },
          "path": "M 395 165 L 515 165 L 515 200 L 515 245 L 395 245 L 395 165 Z"
        },
        {
          "id": "f1-tambour-n1",
          "code": "f1-tambour-n1",
          "name": "Тамбур",
          "mapLabel": "Тамбур",
          "type": "service",
          "mapType": "lobby",
          "wing": "west",
          "schedulable": false,
          "capacity": null,
          "area": 14.66,
          "bbox": {
            "x": 515,
            "y": 50,
            "w": 95,
            "h": 75
          },
          "label": {
            "x": 562.5,
            "y": 87.5
          },
          "path": "M 515 50 L 610 50 L 610 125 L 515 125 L 515 50 Z"
        },
        {
          "id": "f1-tambour-n2",
          "code": "f1-tambour-n2",
          "name": "Тамбур",
          "mapLabel": "Тамбур",
          "type": "service",
          "mapType": "lobby",
          "wing": "west",
          "schedulable": false,
          "capacity": null,
          "area": 14.87,
          "bbox": {
            "x": 515,
            "y": 125,
            "w": 95,
            "h": 75
          },
          "label": {
            "x": 562.5,
            "y": 162.5
          },
          "path": "M 515 125 L 610 125 L 610 190 L 610 200 L 515 200 L 515 165 L 515 125 Z"
        },
        {
          "id": "f1-dispatch",
          "code": "f1-dispatch",
          "name": "Диспетчерская",
          "mapLabel": "Диспетчерская",
          "type": "service",
          "mapType": "service",
          "wing": "west",
          "schedulable": false,
          "capacity": null,
          "area": 19.58,
          "bbox": {
            "x": 610,
            "y": 50,
            "w": 90,
            "h": 140
          },
          "label": {
            "x": 655,
            "y": 120
          },
          "path": "M 610 50 L 700 50 L 700 190 L 610 190 L 610 125 L 610 50 Z"
        },
        {
          "id": "f1-stairs-1",
          "code": "f1-stairs-1",
          "name": "Лестничная клетка",
          "mapLabel": "Лестничная клетка",
          "type": "service",
          "mapType": "stairs",
          "wing": "west",
          "schedulable": false,
          "capacity": null,
          "area": 11.89,
          "bbox": {
            "x": 515,
            "y": 200,
            "w": 95,
            "h": 130
          },
          "label": {
            "x": 562.5,
            "y": 265
          },
          "path": "M 515 200 L 610 200 L 610 330 L 540 330 L 515 330 L 515 245 L 515 200 Z"
        },
        {
          "id": "f1-corr-core-l",
          "code": "f1-corr-core-l",
          "name": "Коридор",
          "mapLabel": "Коридор",
          "type": "service",
          "mapType": "corridor",
          "wing": "west",
          "schedulable": false,
          "capacity": null,
          "area": 14.54,
          "bbox": {
            "x": 610,
            "y": 190,